<?xml version="1.0" encoding="UTF-8"?>
<TimeCard xmlns="http://ns.hr-xml.org/2007-04-15" xmlns:xsi="http://www.w3.org/2001/XMLSchema-instance" xsi:schemaLocation="http://ns.hr-xml.org/2007-04-15
TimeCard.xsd">
	<ReportedResource>
		<Person>
			<Id>
				<IdValue>d026194</IdValue>
			</Id>
		</Person>
	</ReportedResource>
	<ReportedTime>
		<PeriodStartDate>2001-05-01</PeriodStartDate>
		<PeriodEndDate>2001-05-18</PeriodEndDate>
		<TimeInterval type="Regular" billable="true">
			<StartDateTime>2001-05-07T08:00:00</StartDateTime>
			<EndDateTime>2001-05-07T17:00:00</EndDateTime>
			<Duration>PT8H</Duration>
			<AdditionalData type="Task">Repair</AdditionalData>
			<AdditionalData type="Order">1212</AdditionalData>
			<AdditionalData type="CostCenter">700</AdditionalData>
		</TimeInterval>
		<TimeInterval type="Overtime" billable="true">
			<StartDateTime>2001-05-07T07:00:00</StartDateTime>
			<EndDateTime>2001-05-07T19:00:00</EndDateTime>
			<Duration>PT2H</Duration>
			<AdditionalData type="Task">Repair</AdditionalData>
			<AdditionalData type="Order">1212</AdditionalData>
			<AdditionalData type="CostCenter">700</AdditionalData>
			<Comment>Aaabbbccc</Comment>
		</TimeInterval>
		<TimeInterval type="Dirty Work" billable="false">
			<StartDateTime>2001-05-07</StartDateTime>
			<EndDateTime>2001-05-07</EndDateTime>
			<RateOrAmount currency="USD" type="hourly">20</RateOrAmount>
			<AdditionalData type="Task">Repair</AdditionalData>
			<AdditionalData type="Order">1212</AdditionalData>
			<AdditionalData type="CostCenter">700</AdditionalData>
		</TimeInterval>
		<Expense type="Meal" billable="true">
			<ExpenseDate>2001-05-07</ExpenseDate>
			<ExpenseAmount currency="USD">10</ExpenseAmount>
			<AdditionalData type="Order">1212</AdditionalData>
			<AdditionalData type="CostCenter">700</AdditionalData>
		</Expense>
		<TimeInterval type="Vacation">
			<StartDateTime>2001-05-08</StartDateTime>
			<EndDateTime>2001-05-11</EndDateTime>
			<Duration>PT32H</Duration>
		</TimeInterval>
		<TimeInterval type="Regular" billable="true">
			<StartDateTime>2001-05-14T08:00:00</StartDateTime>
			<EndDateTime>2001-05-14T17:00:00</EndDateTime>
			<Duration>PT4H</Duration>
			<AdditionalData type="Task">Production</AdditionalData>
			<AdditionalData type="CostCenter">800</AdditionalData>
		</TimeInterval>
		<TimeInterval type="Sickness">
			<StartDateTime>2001-05-14T13:00:00</StartDateTime>
			<EndDateTime>2001-05-14T17:00:00</EndDateTime>
			<Duration>PT4H</Duration>
		</TimeInterval>
		<TimeInterval type="Sickness">
			<StartDateTime>2001-05-15T08:00:00</StartDateTime>
			<EndDateTime>2001-05-18T15:00:00</EndDateTime>
			<Duration>PT4H</Duration>
		</TimeInterval>
	</ReportedTime>
</TimeCard>
